,PassengerId,Survived,Pclass,Name,Sex,Age,SibSp,Parch,Ticket,Fare,Embarked,First Name,Middle Name,Last Name,Title
841,842,0,2,"Mudd, Mr. Thomas Charles",0,16.0,0,0,S.O./P.P. 3,10.5,S,Thomas,Charles,Mudd, Mr
842,843,1,1,"Serepeca, Miss. Augusta",1,30.0,0,0,113798,31.0,C,Augusta,,Serepeca, Miss
843,844,0,3,"Lemberopolous, Mr. Peter L",0,34.5,0,0,2683,6.4375,C,Peter,L,Lemberopolous, Mr
844,845,0,3,"Culumovic, Mr. Jeso",0,17.0,0,0,315090,8.6625,S,Jeso,,Culumovic, Mr
845,846,0,3,"Abbing, Mr. Anthony",0,42.0,0,0,C.A. 5547,7.55,S,Anthony,,Abbing, Mr
846,847,0,3,"Sage, Mr. Douglas Bullen",0,,8,2,CA. 2343,69.55,S,Douglas,Bullen,Sage, Mr
847,848,0,3,"Markoff, Mr. Marin",0,35.0,0,0,349213,7.8958,C,Marin,,Markoff, Mr
848,849,0,2,"Harper, Rev. John",0,28.0,0,1,248727,33.0,S,John,,Harper, Rev
849,850,1,1,"Goldenberg, Mrs. Samuel L (Edwiga Grabowska)",1,,1,0,17453,89.1042,C,Samuel,L,Goldenberg, Mrs
850,851,0,3,"Andersson, Master. Sigvard Harald Elias",0,4.0,4,2,347082,31.275,S,Sigvard,Harald,Andersson, Master
851,852,0,3,"Svensson, Mr. Johan",0,74.0,0,0,347060,7.775,S,Johan,,Svensson, Mr
852,853,0,3,"Boulos, Miss. Nourelain",1,9.0,1,1,2678,15.2458,C,Nourelain,,Boulos, Miss
853,854,1,1,"Lines, Miss. Mary Conover",1,16.0,0,1,PC 17592,39.4,S,Mary,Conover,Lines, Miss
854,855,0,2,"Carter, Mrs. Ernest Courtenay (Lilian Hughes)",1,44.0,1,0,244252,26.0,S,Ernest,Courtenay,Carter, Mrs
855,856,1,3,"Aks, Mrs. Sam (Leah Rosen)",1,18.0,0,1,392091,9.35,S,Sam,(Leah,Aks, Mrs
856,857,1,1,"Wick, Mrs. George Dennick (Mary Hitchcock)",1,45.0,1,1,36928,164.8667,S,George,Dennick,Wick, Mrs
857,858,1,1,"Daly, Mr. Peter Denis ",0,51.0,0,0,113055,26.55,S,Peter,Denis,Daly, Mr
858,859,1,3,"Baclini, Mrs. Solomon (Latifa Qurban)",1,24.0,0,3,2666,19.2583,C,Solomon,(Latifa,Baclini, Mrs
859,860,0,3,"Razi, Mr. Raihed",0,,0,0,2629,7.2292,C,Raihed,,Razi, Mr
860,861,0,3,"Hansen, Mr. Claus Peter",0,41.0,2,0,350026,14.1083,S,Claus,Peter,Hansen, Mr
861,862,0,2,"Giles, Mr. Frederick Edward",0,21.0,1,0,28134,11.5,S,Frederick,Edward,Giles, Mr
862,863,1,1,"Swift, Mrs. Frederick Joel (Margaret Welles Barron)",1,48.0,0,0,17466,25.9292,S,Frederick,Joel,Swift, Mrs
863,864,0,3,"Sage, Miss. Dorothy Edith ""Dolly""",1,,8,2,CA. 2343,69.55,S,Dorothy,Edith,Sage, Miss
864,865,0,2,"Gill, Mr. John William",0,24.0,0,0,233866,13.0,S,John,William,Gill, Mr
865,866,1,2,"Bystrom, Mrs. (Karolina)",1,42.0,0,0,236852,13.0,S,(Karolina),,Bystrom, Mrs
866,867,1,2,"Duran y More, Miss. Asuncion",1,27.0,1,0,SC/PARIS 2149,13.8583,C,Asuncion,,Duran y More, Miss
867,868,0,1,"Roebling, Mr. Washington Augustus II",0,31.0,0,0,PC 17590,50.4958,S,Washington,Augustus,Roebling, Mr
868,869,0,3,"van Melkebeke, Mr. Philemon",0,,0,0,345777,9.5,S,Philemon,,van Melkebeke, Mr
869,870,1,3,"Johnson, Master. Harold Theodor",0,4.0,1,1,347742,11.1333,S,Harold,Theodor,Johnson, Master
870,871,0,3,"Balkic, Mr. Cerin",0,26.0,0,0,349248,7.8958,S,Cerin,,Balkic, Mr
871,872,1,1,"Beckwith, Mrs. Richard Leonard (Sallie Monypeny)",1,47.0,1,1,11751,52.5542,S,Richard,Leonard,Beckwith, Mrs
872,873,0,1,"Carlsson, Mr. Frans Olof",0,33.0,0,0,695,5.0,S,Frans,Olof,Carlsson, Mr
873,874,0,3,"Vander Cruyssen, Mr. Victor",0,47.0,0,0,345765,9.0,S,Victor,,Vander Cruyssen, Mr
874,875,1,2,"Abelson, Mrs. Samuel (Hannah Wizosky)",1,28.0,1,0,P/PP 3381,24.0,C,Samuel,(Hannah,Abelson, Mrs
875,876,1,3,"Najib, Miss. Adele Kiamie ""Jane""",1,15.0,0,0,2667,7.225,C,Adele,Kiamie,Najib, Miss
876,877,0,3,"Gustafsson, Mr. Alfred Ossian",0,20.0,0,0,7534,9.8458,S,Alfred,Ossian,Gustafsson, Mr
877,878,0,3,"Petroff, Mr. Nedelio",0,19.0,0,0,349212,7.8958,S,Nedelio,,Petroff, Mr
878,879,0,3,"Laleff, Mr. Kristo",0,,0,0,349217,7.8958,S,Kristo,,Laleff, Mr
879,880,1,1,"Potter, Mrs. Thomas Jr (Lily Alexenia Wilson)",1,56.0,0,1,11767,83.1583,C,Thomas,Jr,Potter, Mrs
880,881,1,2,"Shelley, Mrs. William (Imanita Parrish Hall)",1,25.0,0,1,230433,26.0,S,William,(Imanita,Shelley, Mrs
881,882,0,3,"Markun, Mr. Johann",0,33.0,0,0,349257,7.8958,S,Johann,,Markun, Mr
882,883,0,3,"Dahlberg, Miss. Gerda Ulrika",1,22.0,0,0,7552,10.5167,S,Gerda,Ulrika,Dahlberg, Miss
883,884,0,2,"Banfield, Mr. Frederick James",0,28.0,0,0,C.A./SOTON 34068,10.5,S,Frederick,James,Banfield, Mr
884,885,0,3,"Sutehall, Mr. Henry Jr",0,25.0,0,0,SOTON/OQ 392076,7.05,S,Henry,Jr,Sutehall, Mr
885,886,0,3,"Rice, Mrs. William (Margaret Norton)",1,39.0,0,5,382652,29.125,Q,William,(Margaret,Rice, Mrs
886,887,0,2,"Montvila, Rev. Juozas",0,27.0,0,0,211536,13.0,S,Juozas,,Montvila, Rev
887,888,1,1,"Graham, Miss. Margaret Edith",1,19.0,0,0,112053,30.0,S,Margaret,Edith,Graham, Miss
888,889,0,3,"Johnston, Miss. Catherine Helen ""Carrie""",1,,1,2,W./C. 6607,23.45,S,Catherine,Helen,Johnston, Miss
889,890,1,1,"Behr, Mr. Karl Howell",0,26.0,0,0,111369,30.0,C,Karl,Howell,Behr, Mr
890,891,0,3,"Dooley, Mr. Patrick",0,32.0,0,0,370376,7.75,Q,Patrick,,Dooley, Mr
